{"$defs":{"commit":{"pattern":"^[0-9a-f]{40}$","type":"string"},"digest":{"pattern":"^[0-9a-f]{64}$","type":"string"},"file":{"additionalProperties":false,"properties":{"byte_count":{"maximum":2000000,"minimum":1,"type":"integer"},"path":{"maxLength":512,"minLength":1,"type":"string"},"sha256":{"$ref":"#/$defs/digest"}},"required":["path","byte_count","sha256"],"type":"object"}},"$schema":"https://json-schema.org/draft/2020-12/schema","additionalProperties":false,"properties":{"accepted_rc1":{"additionalProperties":false,"properties":{"catalog":{"$ref":"#/$defs/file"},"corpus_version":{"const":"career-bench-v1"},"validator":{"$ref":"#/$defs/file"}},"required":["corpus_version","catalog","validator"],"type":"object"},"accepted_rc2":{"additionalProperties":false,"properties":{"contract_version":{"const":"rc2-claude-code-reference-v4"},"registration":{"$ref":"#/$defs/file"},"source_snapshot":{"$ref":"#/$defs/file"},"validator":{"$ref":"#/$defs/file"}},"required":["contract_version","registration","source_snapshot","validator"],"type":"object"},"execution_materialization":{"const":{"base_image":{"digest":"sha256:3638d9a6fe4030bd716be989438248074489337ba3275657f93595428be4fc03","node_version":"24.19.0","platform":"linux/amd64"},"package_profile":{"assembly_manifest_sha256":"3a069ccca031e493d38f5494aff192f9ed329850da29037304b23485b7a3cc23","distribution_manifest_sha256":"7dc4a35510947b34a60fed168810bdb2d54ef842a271127f3e9b9753c17e8fb1","inventory_byte_count":58894,"inventory_sha256":"bec897c13c2e79233a5bc677563918db6fe119eba6f38c55a2204a0f65eddff4","package_count":244,"profile_lock_byte_count":1058486,"profile_lock_sha256":"379b34881b7cac8a31cc5b48b4f71b8ddaa5f30e9c610843b049ac91825ff114"},"packaging_status":{"exact_archive_matches":242,"nonreproducible_archives":["honcho-bundle","rlm-bundle"],"repeated_archive_count":244,"status":"selected_materialization_validated_not_reproducible"},"parent_image":{"config_digest":"sha256:45dc302558a43efbc5733e766b3914f775aee5f203f51383067e08bb3c5c150f","reference":"recursus-rc3-v14:final@sha256:deabeef3bc35a39a2ba3924bf66c7d06dfccb143db3b72d4cb84034a08005062"},"runner_layer":{"build_definition":{"byte_count":564,"path":"evals/recursus/rc3-recursus-direct-v15/container/Dockerfile.runner","sha256":"d3714aaf0b68a08e06f1253e422abb7a7a5b6fb952eb7c663d5a7f2a6670362b"},"context_file_byte_count":107269,"context_file_count":9,"context_inventory_byte_count":1298,"context_inventory_file":{"byte_count":1299,"path":"evals/recursus/rc3-recursus-direct-v15/runner-context-inventory.json","sha256":"a738b2fb42addd08638216c4d1b9439d54235b19eab9c694bf4aa208985d13b4"},"context_inventory_sha256":"b86240f01ce7766a68b292c9d45ddc86f5568a7c9d4f7d692be530c6909cf0ad"},"worker_image":{"config_digest":"sha256:d080bcb385531c1d005c45175ec23afa19ea68ce2ff17d539637e2189056523d","descriptor_digest":"sha256:d0a67e848a3a2b0879ccdbb92a87b5f250c8c70c8ce0eaae2e7d291b538646bc","entrypoint":["/usr/local/bin/node"],"manifest_digest":"sha256:5ab02925b0ba65f2cbf63c1b76df374e9b43e9ce405af0909871a9613e25f58a","platform":"linux/amd64","reference":"recursus-rc3-v15@sha256:d0a67e848a3a2b0879ccdbb92a87b5f250c8c70c8ce0eaae2e7d291b538646bc","user":"65532:65532"}}},"registration":{"$ref":"#/$defs/file"},"registration_id":{"const":"RC3-REC-DIRECT-2026-08-25-V15"},"runner_files":{"items":{"$ref":"#/$defs/file"},"maxItems":64,"minItems":10,"type":"array","uniqueItems":true},"schema_version":{"const":"1.0"},"snapshot_id":{"const":"RC3-SOURCE-SNAPSHOT-2026-08-25-V15"},"sources":{"items":{"additionalProperties":false,"properties":{"entrypoints":{"items":{"maxLength":160,"minLength":3,"type":"string"},"maxItems":8,"minItems":1,"type":"array","uniqueItems":true},"id":{"maxLength":64,"minLength":3,"type":"string"},"repository":{"pattern":"^https://github.com/OpenCnid/[A-Za-z0-9._-]+$","type":"string"},"revision":{"$ref":"#/$defs/commit"},"version":{"maxLength":64,"minLength":1,"type":"string"}},"required":["id","repository","revision","version","entrypoints"],"type":"object"},"maxItems":3,"minItems":3,"type":"array","uniqueItems":true},"synthetic":{"const":true}},"required":["schema_version","snapshot_id","registration_id","synthetic","registration","accepted_rc1","accepted_rc2","sources","runner_files","execution_materialization"],"type":"object"}
