{"accepted_rc1":{"catalog":{"byte_count":6670,"path":"evals/recursus/career-bench-v1/catalog.json","sha256":"279236023eceaa105aa0c13d20c5867d860423f0d6d297c3052074e1ad230200"},"corpus_version":"career-bench-v1","validator":{"byte_count":312,"path":"verify-recursus-benchmark.mjs","sha256":"228040e8a83e0c0b3cf7643ef96e6542c1d1cde37865fb22e99b8272f1d8a5b7"}},"accepted_rc2":{"contract_version":"rc2-claude-code-reference-v4","registration":{"byte_count":4192,"path":"evals/recursus/rc2-claude-code-reference-v4/registration.json","sha256":"28e1e10656d941ab1173f77a6332b0140312b3d55bfb1f8b6d04f3c23a899597"},"source_snapshot":{"byte_count":4411,"path":"evals/recursus/rc2-claude-code-reference-v4/source-snapshot.json","sha256":"8b474dd7c1dbdc276db33b3104e634e804edbbaeaadc43bb70a666d9dbe739ea"},"validator":{"byte_count":1853,"path":"verify-recursus-reference-v4.mjs","sha256":"ac990a72cd0f13bc6268c635f0c3babf2debe2671a965eb2497a2ada8cb448ce"}},"execution_materialization":{"base_image":{"digest":"sha256:3638d9a6fe4030bd716be989438248074489337ba3275657f93595428be4fc03","node_version":"24.19.0","platform":"linux/amd64"},"package_profile":{"assembly_manifest_sha256":"3a069ccca031e493d38f5494aff192f9ed329850da29037304b23485b7a3cc23","distribution_manifest_sha256":"7dc4a35510947b34a60fed168810bdb2d54ef842a271127f3e9b9753c17e8fb1","inventory_byte_count":58894,"inventory_sha256":"bec897c13c2e79233a5bc677563918db6fe119eba6f38c55a2204a0f65eddff4","package_count":244,"profile_lock_byte_count":1058486,"profile_lock_sha256":"379b34881b7cac8a31cc5b48b4f71b8ddaa5f30e9c610843b049ac91825ff114"},"packaging_status":{"exact_archive_matches":242,"nonreproducible_archives":["honcho-bundle","rlm-bundle"],"repeated_archive_count":244,"status":"selected_materialization_validated_not_reproducible"},"parent_image":{"config_digest":"sha256:45dc302558a43efbc5733e766b3914f775aee5f203f51383067e08bb3c5c150f","reference":"recursus-rc3-v14:final@sha256:deabeef3bc35a39a2ba3924bf66c7d06dfccb143db3b72d4cb84034a08005062"},"runner_layer":{"build_definition":{"byte_count":564,"path":"evals/recursus/rc3-recursus-direct-v15/container/Dockerfile.runner","sha256":"d3714aaf0b68a08e06f1253e422abb7a7a5b6fb952eb7c663d5a7f2a6670362b"},"context_file_byte_count":107269,"context_file_count":9,"context_inventory_byte_count":1298,"context_inventory_file":{"byte_count":1299,"path":"evals/recursus/rc3-recursus-direct-v15/runner-context-inventory.json","sha256":"a738b2fb42addd08638216c4d1b9439d54235b19eab9c694bf4aa208985d13b4"},"context_inventory_sha256":"b86240f01ce7766a68b292c9d45ddc86f5568a7c9d4f7d692be530c6909cf0ad"},"worker_image":{"config_digest":"sha256:d080bcb385531c1d005c45175ec23afa19ea68ce2ff17d539637e2189056523d","descriptor_digest":"sha256:d0a67e848a3a2b0879ccdbb92a87b5f250c8c70c8ce0eaae2e7d291b538646bc","entrypoint":["/usr/local/bin/node"],"manifest_digest":"sha256:5ab02925b0ba65f2cbf63c1b76df374e9b43e9ce405af0909871a9613e25f58a","platform":"linux/amd64","reference":"recursus-rc3-v15@sha256:d0a67e848a3a2b0879ccdbb92a87b5f250c8c70c8ce0eaae2e7d291b538646bc","user":"65532:65532"}},"registration":{"byte_count":8145,"path":"evals/recursus/rc3-recursus-direct-v15/registration.json","sha256":"0d2bb2e0212642105a6a8385a05a60a57850249762a1b0f5b46f36e2f6a6c76a"},"registration_id":"RC3-REC-DIRECT-2026-08-25-V15","runner_files":[{"byte_count":3035,"path":"capture-recursus-route-v15.mjs","sha256":"3373ac84a869333a7eed9b6628eb92d5929618b06bdfc852a83e10e9f1c82994"},{"byte_count":564,"path":"evals/recursus/rc3-recursus-direct-v15/container/Dockerfile.runner","sha256":"d3714aaf0b68a08e06f1253e422abb7a7a5b6fb952eb7c663d5a7f2a6670362b"},{"byte_count":1299,"path":"evals/recursus/rc3-recursus-direct-v15/runner-context-inventory.json","sha256":"a738b2fb42addd08638216c4d1b9439d54235b19eab9c694bf4aa208985d13b4"},{"byte_count":1068,"path":"evals/recursus/rc3-recursus-direct-v15/schemas/artifact-inventory.schema.json","sha256":"7e00731ce084e4123c35468f7a5d3aa213192ab8792c82d9b102fcf472bb56b9"},{"byte_count":804,"path":"evals/recursus/rc3-recursus-direct-v15/schemas/attempt-intent.schema.json","sha256":"f519b41da684cce26d5d249b38586aad304758851993b700ecda1b18aea38b5e"},{"byte_count":715,"path":"evals/recursus/rc3-recursus-direct-v15/schemas/attempt-reservation.schema.json","sha256":"1db99f6474520c35a0cc181af4cd6d76718da1f264f41daf456b849f8265182c"},{"byte_count":3252,"path":"evals/recursus/rc3-recursus-direct-v15/schemas/authority-observation.schema.json","sha256":"4f17fc352de575e82ff4756995c2056b985fa7a8fc8457c3171bd54af13c45da"},{"byte_count":2506,"path":"evals/recursus/rc3-recursus-direct-v15/schemas/bridge-input.schema.json","sha256":"fae557b8d32751f9daf640cb0d1636968fd3cadae63858eed26893e3382c4dae"},{"byte_count":1279,"path":"evals/recursus/rc3-recursus-direct-v15/schemas/ledger-entry.schema.json","sha256":"c7e28e9a1051914cdc5a10369a1793e90b9c65e4bb18126540b87ad9e23d938a"},{"byte_count":2649,"path":"evals/recursus/rc3-recursus-direct-v15/schemas/normalized-result.schema.json","sha256":"9f0fe26d6d14dcfaaa3d45e5c525d4f8dfd6843d7678f59884f3c5d842ddeb8d"},{"byte_count":11031,"path":"evals/recursus/rc3-recursus-direct-v15/schemas/registration.schema.json","sha256":"4bb6dfd53edcc62bdf2c3d77ba85558ad0ff62fd11d9e7b71b818ee808eb46ec"},{"byte_count":15622,"path":"evals/recursus/rc3-recursus-direct-v15/schemas/runner-manifest.schema.json","sha256":"7cf333b0937d1a195c3214ec7fe1373ba950f860f07c123d98424e651c074f6c"},{"byte_count":784,"path":"evals/recursus/rc3-recursus-direct-v15/schemas/seed-inventory.schema.json","sha256":"43f056902ef04b0d7faf6bc7ff5326c200024f8bd18bfa1a4d50750a03cf432a"},{"byte_count":4297,"path":"evals/recursus/rc3-recursus-direct-v15/schemas/source-snapshot.schema.json","sha256":"cf591895979cae71f33ef9e6996e85d66d5ab1ed292a944795ee255ea06c223b"},{"byte_count":1426,"path":"evals/recursus/rc3-recursus-direct-v15/schemas/trace.schema.json","sha256":"9ba2c9444a641f8f1e101362e2f238f1920d284dec5a6f9b9142f02e4e98a919"},{"byte_count":1661,"path":"evals/recursus/rc3-recursus-direct-v15/schemas/validation-result.schema.json","sha256":"4340d970dfff2f6718c7e03335c4f7afd3bf06342369797bae9e607f08d66655"},{"byte_count":1122,"path":"evals/recursus/rc3-recursus-direct-v15/schemas/workspace-inventory.schema.json","sha256":"d821aa006d3b4d057bc599063388a2fb41dbdd6d4e7ea7cdce67bd6382cf27ca"},{"byte_count":4238,"path":"evals/recursus/rc3-recursus-direct-v15/schemas/worker-observation.schema.json","sha256":"875e8e4a6ff34b1d1a47f71055a48927f3e1d826abcd53022f8d7437a5aea0eb"},{"byte_count":60658,"path":"lib/recursus-benchmark.mjs","sha256":"769948690b99e00047035126fc3085875e30fd7b5f89df3a7785c8536c3a98b9"},{"byte_count":1347,"path":"lib/recursus-route-credential-permission-v15.mjs","sha256":"cc746b71374b571ff694b47cf50a87dce8bddb657536c49f62dbce83f591cea8"},{"byte_count":20414,"path":"lib/recursus-route-content-gate-v15.mjs","sha256":"5dd4fcc2476a18751bab4078c98c2bfbefddfb717a185859607a739f53bd10b8"},{"byte_count":41635,"path":"lib/recursus-route-html-entities-v15.mjs","sha256":"52d1442b546be20f20d5e7d42182a8809c2b18ab90bb4fbe3919410fd17bb8e6"},{"byte_count":53981,"path":"lib/recursus-route-capture-v15.mjs","sha256":"c3a32090c3fdb97f5ae360bc20da507dd70807265491b6a09def2756c57c897f"},{"byte_count":1614,"path":"lib/recursus-route-denial-probe-v15.mjs","sha256":"234a120c015fb0de455f2d6673424ee06f6f1fe3604e1b595f24efb0503d6900"},{"byte_count":9400,"path":"lib/recursus-route-proxy-v15.mjs","sha256":"db1b855d3b7de18d6450b3655cc0e85b86bf959030434766047e711063dd23b5"},{"byte_count":1400,"path":"lib/recursus-route-relay-v15.mjs","sha256":"efa012e29a835ce84bdca9dbf7e04dccc91331cf47fda461ea8e81a34d421b46"},{"byte_count":417,"path":"lib/recursus-route-socket-init-v15.mjs","sha256":"21889e229d1924a67cd43af9330d6aa83f34092602a1dcdf5f0adde3e4e960e6"},{"byte_count":99174,"path":"lib/recursus-route-v15.mjs","sha256":"40c2ab6e4d5603ebe5a6a53eb0f408352eca0a9fc5fc10df818905996df4953f"},{"byte_count":30478,"path":"lib/recursus-route-worker-v15.mjs","sha256":"d5b82311a5baac9a766cb0efab84fce28bb39b6b557f77868e263cc9521469dc"},{"byte_count":3374,"path":"prepare-recursus-route-v15.mjs","sha256":"bfd487b0ad88db6ea5034d9ad8218fa448f251be1cefdd70ce8cdc64c5c0d0bc"},{"byte_count":25450,"path":"scripts/freeze-recursus-route-v15.mjs","sha256":"f304702b9ffa1b66f608d7eef58fcc10fdd0639f46dabc4103db7443da0facb1"},{"byte_count":58241,"path":"tests/recursus/execution-bridge-v15.test.mjs","sha256":"fce5f94b3ac7c3966b3bdd9a3f72d0a9aa26a886dc4837154aceaf1b9ee2fda6"},{"byte_count":1613,"path":"verify-recursus-route-v15.mjs","sha256":"1f379d7f952c9ddbc32803fc9a98ded8cda3c38043d971544663120cdee11d2b"}],"schema_version":"1.0","snapshot_id":"RC3-SOURCE-SNAPSHOT-2026-08-25-V15","sources":[{"entrypoints":["@deepseek-ai/dsh-agent","@deepseek-ai/dsh-agent-loop","@deepseek-ai/dsh-credentials-local","@deepseek-ai/dsh-llm"],"id":"deepseek-harness","repository":"https://github.com/OpenCnid/deepseek-harness","revision":"e52c224fe00954fb7e8cda19eb2411dceef15989","version":"dsh-v0.1.0-rc.7"},{"entrypoints":["lib/index.js","OpenAICodexAdapter"],"id":"deepseek-openai-codex","repository":"https://github.com/OpenCnid/deepseek-openai-codex","revision":"5232102d0cc8bd55d5bf27b6eb203efbf6ada8a9","version":"0.1.0"},{"entrypoints":["packages/assembly/lib/index.js","scripts/manage-profile.mjs"],"id":"recursus","repository":"https://github.com/OpenCnid/recursus","revision":"4444405e8b34124b1518fa2a66d0223e202234e4","version":"0.0.0-foundation"}],"synthetic":true}
